{
  "schema_version": 1,
  "family_id": "primary-comparisons-small",
  "method": "holm",
  "alpha": 0.05,
  "family_size": 4,
  "results": [
    {
      "identity": {
        "tier": "core",
        "budget": 4,
        "alternative": "simulation_informed",
        "reference": "cvss",
        "outcome": "mission_impact"
      },
      "raw_p_value": 9.999000099990002e-05,
      "adjusted_p_value": 0.00039996000399960006,
      "reject_null": true
    },
    {
      "identity": {
        "tier": "core",
        "budget": 6,
        "alternative": "simulation_informed",
        "reference": "cvss",
        "outcome": "mission_impact"
      },
      "raw_p_value": 9.999000099990002e-05,
      "adjusted_p_value": 0.00039996000399960006,
      "reject_null": true
    },
    {
      "identity": {
        "tier": "edge",
        "budget": 4,
        "alternative": "heuristic",
        "reference": "cvss",
        "outcome": "mission_impact"
      },
      "raw_p_value": 1.0,
      "adjusted_p_value": 1.0,
      "reject_null": false
    },
    {
      "identity": {
        "tier": "edge",
        "budget": 6,
        "alternative": "heuristic",
        "reference": "cvss",
        "outcome": "mission_impact"
      },
      "raw_p_value": 0.029397060293970604,
      "adjusted_p_value": 0.05879412058794121,
      "reject_null": false
    }
  ]
}
